{"protocol":"v12-cross-run-publication-draft-v3","language":"tr","surah":106,"ayat":[{"ayah_ref":"106:0","findings":[{"text":"Açılışta Allah'ın adının anılması, surenin ilerideki kulluk buyruğunu baştan Allah'a yönelten bir eşik işlevi görür.","grade":"strong","anchors":["a-s106-0044","a-s106-0005"]},{"text":"Buradaki iki merhamet niteliği, surenin sonunda topluluğu besleme ve korkudan koruma biçiminde somutlaşan etkin bir bakım olarak belirginleşir.","grade":"strong","anchors":["a-s106-0039"]},{"text":"Merhametin akrabalık ve rahim çağrışımları, yolculuk eden topluluğu barındıran, büyüten ve besleyen bir hane bakımı boyutu ekler.","grade":"weak","anchors":["a-s106-0040","a-s106-0041"]},{"text":"Açılıştaki adlandırma, mevsimlik hareketin üzerinde koruyucu bir örtü gibi de okunabilir.","grade":"reject","anchors":["a-s106-0043"]}]},{"ayah_ref":"106:1","findings":[{"text":"Alışma, hareketsiz bir âdetten çok, yinelenen yolculuğu güvenilir bir düzene dönüştüren edinilmiş bir bağlılıktır.","grade":"strong","anchors":["a-s106-0003"]},{"text":"Bu alışma, ayrılabilecek insanları, güzergâhları ve mevsimleri tek bir dolaşım düzeninde birleştiren toplumsal bir bağdır.","grade":"strong","anchors":["a-s106-0002"]},{"text":"Sonraki güven vurgusu, bu alışkanlığın kendiliğinden değil, kesintiye uğrama korkusu giderilerek sürdürülen korunaklı bir beklenti olduğunu gösterir.","grade":"weak","anchors":["a-s106-0003"]},{"text":"Kureyş adı altında çok sayıda parçanın tek bir topluluk halinde toplanması da alışmanın ikincil bir boyutu olarak sezilir.","grade":"reject","anchors":["a-s106-0001"]},{"text":"Alışma, hareket eden topluluğun yine de merkeze bağlı kaldığı bir evcilleştirme benzetmesine kadar genişletilebilir.","grade":"reject","anchors":["a-s106-0003"]}]},{"ayah_ref":"106:2","findings":[{"text":"Tekil yolculuk ifadesi, kışı ve yazı yol üzerindeki duraklarla birlikte birbirine bağlayan yinelenen bir yıllık devreyi görünür kılar.","grade":"strong","anchors":["a-s106-0002","a-s106-0035","a-s106-0046","a-s106-0049"]},{"text":"Yolculuk, yalnızca hareketi değil, eyer ve donanım, elverişli binek ve yol yardımını kapsayan maddi bir hazırlık düzenini de içerir.","grade":"strong","anchors":["a-s106-0031","a-s106-0032","a-s106-0034","a-s106-0037"]},{"text":"Yolculuk, taşınan barınma eşyaları ve ardışık konaklarla geçici bir barınma düzeni niteliği de kazanır.","grade":"weak","anchors":["a-s106-0033","a-s106-0035"]},{"text":"Sonraki açlık vurgusu, kışı yalnızca bir tarih olmaktan çıkarıp dönemsel kıtlık ve yoksunluk riski olarak da okutur.","grade":"strong","anchors":["a-s106-0048"]},{"text":"Kış ve yaz, yağış ve bitki örtüsü bakımından farklı üretim imkânları sunan ekolojik dönemler olarak da belirir.","grade":"weak","anchors":["a-s106-0047","a-s106-0050"]},{"text":"Yaz ayrıca mevsimlik erzak ve alışveriş dönemi olarak ekonomik bir boyut kazanır.","grade":"weak","anchors":["a-s106-0051"]},{"text":"Yolculuğun uzaklaştırma ve zarar yükleme çağrışımları, son ayetteki güvenle birlikte, bu hareketin sürgün ya da zorlanma değil korunan bir hareketlilik olduğunu düşündürür.","grade":"weak","anchors":["a-s106-0036","a-s106-0038"]}]},{"ayah_ref":"106:3","findings":[{"text":"Rab unvanı, mevsimler boyunca besleme ve güvenliği sürdüren, topluluğu aşama aşama gözetip tamamlayan bir yöneticilik boyutu kazanır.","grade":"strong","anchors":["a-s106-0022"]},{"text":"Ev ile Rab arasındaki ilişki, Kureyş'i beslenip korunan bir hane halkı olarak, Rabbi ise bu haneyi gözeten olarak düşündürür.","grade":"weak","anchors":["a-s106-0009","a-s106-0024"]},{"text":"Bu ev, yalnızca bir yapı değil, mevsimlik hareketi çevresinde toplayan ve Kureyş'e ortak kimlik veren toplumsal bir merkezdir.","grade":"strong","anchors":["a-s106-0008","a-s106-0009","a-s106-0013"]},{"text":"Evin barınak ve gece tehlikesi çağrışımları, onun korumasının yolculuk güzergâhlarındaki korkuya karşı da uzandığını düşündürür.","grade":"weak","anchors":["a-s106-0008","a-s106-0010"]},{"text":"Kulluk, yolun düzeltilip geçilebilir kılınmasına benzer biçimde, dağınık yönelişlerin tek bir merkeze bağlanması olarak da okunabilir.","grade":"reject","anchors":["a-s106-0060","a-s106-0062"]},{"text":"Buyruk, evin ve soyun itibarını bağımsız bir övünç olmaktan çıkarıp evin Rabbine yöneltir.","grade":"weak","anchors":["a-s106-0021","a-s106-0013","a-s106-0061"]},{"text":"Rablikte, ev çevresindeki güvenli düzeni bir antlaşma ve koruma güvencesiyle bir arada tutma boyutu da varsayılabilir.","grade":"reject","anchors":["a-s106-0027"]}]},{"ayah_ref":"106:4","findings":[{"text":"Besleme, tek seferlik doyurmanın ötesinde, kıtlık dönemlerine karşı geçim kaynaklarını ve toplumsal iyi durumu sürdüren kalıcı bir düzeni kapsar.","grade":"strong","anchors":["a-s106-0054","a-s106-0015"]},{"text":"Besleme, yolculuk kollarından gelen kaynakların yerel düzene aşılanması biçiminde de tasarlanabilir.","grade":"reject","anchors":["a-s106-0058"]},{"text":"Besleme, mevsimsel koşulların ürünü olgunlaştırması yoluyla gıdayı hazır hale getiren bir süreç boyutu da kazanır.","grade":"weak","anchors":["a-s106-0055"]},{"text":"Güvenlik, iç huzurun yanında, güzergâhları, taşıyıcıları ve ilişkileri tekrarlanan yolculuk için güvenilir kılan emniyetli geçişi de kapsar.","grade":"strong","anchors":["a-s106-0006"]},{"text":"Korku, beklenen zararın yanı sıra malı, insanı ve hareket kapasitesini eksilten, hayatı görünür biçimde daraltan bir durum olarak da okunabilir.","grade":"weak","anchors":["a-s106-0019","a-s106-0020"]},{"text":"Yaşanan güvenliğin kulluğa götüren güven ve onayı doğurduğu da düşünülebilir.","grade":"reject","anchors":["a-s106-0007"]}]}]}
